{
  "schema_version": "0.2",
  "max_api_calls": 24,
  "max_solver_steps": 8,
  "max_revisions": 2,
  "transport_retries": 1,
  "timeout_seconds": 180,
  "max_input_bytes": 450000,
  "max_response_bytes": 1500000,
  "review_mode": "assistant",
  "models": {
    "material_generator": {
      "base_url": "https://api.deepseek.com",
      "api_key_env": "DEEPSEEK_API_KEY",
      "model": "deepseek-flash",
      "max_tokens": 16384,
      "temperature": 0.3,
      "thinking": "enabled",
      "reasoning_effort": "high"
    },
    "material_critic": {
      "base_url": "https://api.deepseek.com",
      "api_key_env": "DEEPSEEK_API_KEY",
      "model": "deepseek-flash",
      "max_tokens": 16384,
      "temperature": 0.3,
      "thinking": "enabled",
      "reasoning_effort": "high"
    },
    "material_solver": {
      "base_url": "https://api.deepseek.com",
      "api_key_env": "DEEPSEEK_API_KEY",
      "model": "deepseek-flash",
      "max_tokens": 16384,
      "temperature": 0.3,
      "thinking": "enabled",
      "reasoning_effort": "high"
    },
    "material_judge": {
      "base_url": "https://api.deepseek.com",
      "api_key_env": "DEEPSEEK_API_KEY",
      "model": "deepseek-flash",
      "max_tokens": 16384,
      "temperature": 0.3,
      "thinking": "enabled",
      "reasoning_effort": "high"
    }
  }
}
